{
  "frameworkVersion": "2.73.0",
  "adoptedAt": "2026-06-12T10:22:18.688Z",
  "adoptedFromCommit": "ed577bd758372fc2c1e3871717a0f1f672032a8d",
  "profile": "STANDARD",
  "substitutions": {
    "PROJECT_NAME": "audit-tool",
    "PROJECT_DESCRIPTION": "Internal security audit tool: static (SAST) scanning of our source repos plus live (DAST) scanning of allowlisted staging URLs, merged into one prioritized remediation report.",
    "STACK_DESCRIPTION": "Node 20+ / TypeScript (ESM, npm); ts-morph AST rule engine; Semgrep, gitleaks, osv-scanner, OWASP ZAP, Nuclei shelled out and version-pinned; Zod schemas; Vitest; eslint + typescript-eslint",
    "COMPANY_NAME": "Breakout Solutions"
  },
  "files": {
    ".claude/agents/adversarial-reviewer.md": {
      "lastAppliedHash": "e0077d553fe39d731b4fef5754340c1255c5a3ff319ad6d4d845f8c96592d9f6",
      "lastAppliedFrameworkVersion": "2.73.0",
      "lastAppliedFrameworkCommit": "851d5d35f097f25058adc6a2e54219c69183f05e",
      "lastAppliedSourcePath": ".claude/agents/*.md",
      "customisedLocally": false
    },
    ".claude/agents/architect.md": {
      "lastAppliedHash": "46d43ee1cd99cbe1fd95e880b9d10f1c8da199f7154cafbcaf405bf552cf2c44",
      "lastAppliedFrameworkVersion": "2.73.0",
      "lastAppliedFrameworkCommit": "851d5d35f097f25058adc6a2e54219c69183f05e",
      "lastAppliedSourcePath": ".claude/agents/*.md",
      "customisedLocally": false
    },
    ".claude/agents/audit-runner.md": {
      "lastAppliedHash": "d87e4b0aa68e49dde91d7a8b72f13278744ba7076acf2684c215ee5793407d0c",
      "lastAppliedFrameworkVersion": "2.73.0",
      "lastAppliedFrameworkCommit": "851d5d35f097f25058adc6a2e54219c69183f05e",
      "lastAppliedSourcePath": ".claude/agents/*.md",
      "customisedLocally": false
    },
    ".claude/agents/bug-fixer.md": {
      "lastAppliedHash": "35364b09f7e5f02b9c5f8af862a0ec87026ad933a22c0045441431a365c7d826",
      "lastAppliedFrameworkVersion": "2.73.0",
      "lastAppliedFrameworkCommit": "851d5d35f097f25058adc6a2e54219c69183f05e",
      "lastAppliedSourcePath": ".claude/agents/*.md",
      "customisedLocally": false
    },
    ".claude/agents/builder.md": {
      "lastAppliedHash": "217f1624233638416ad03ae4ffa3ec097411de1fc49b7f78a78fa151af9371f0",
      "lastAppliedFrameworkVersion": "2.73.0",
      "lastAppliedFrameworkCommit": "851d5d35f097f25058adc6a2e54219c69183f05e",
      "lastAppliedSourcePath": ".claude/agents/*.md",
      "customisedLocally": false
    },
    ".claude/agents/chatgpt-plan-review.md": {
      "lastAppliedHash": "82198cef0c35d02c8a957e4be313f7bcf041186b6f712a1e67afbea0740576bc",
      "lastAppliedFrameworkVersion": "2.73.0",
      "lastAppliedFrameworkCommit": "851d5d35f097f25058adc6a2e54219c69183f05e",
      "lastAppliedSourcePath": ".claude/agents/*.md",
      "customisedLocally": false
    },
    ".claude/agents/chatgpt-pr-review.md": {
      "lastAppliedHash": "2d7fcc63475282c5fde72c41c5b40212d464273574d1f9eee701aaa9ab58c7ea",
      "lastAppliedFrameworkVersion": "2.73.0",
      "lastAppliedFrameworkCommit": "851d5d35f097f25058adc6a2e54219c69183f05e",
      "lastAppliedSourcePath": ".claude/agents/*.md",
      "customisedLocally": false
    },
    ".claude/agents/chatgpt-spec-review.md": {
      "lastAppliedHash": "f3b72dbfcecc0fb6197d088f69f374764bdc2f8e550918ee067dfa065f462f48",
      "lastAppliedFrameworkVersion": "2.73.0",
      "lastAppliedFrameworkCommit": "851d5d35f097f25058adc6a2e54219c69183f05e",
      "lastAppliedSourcePath": ".claude/agents/*.md",
      "customisedLocally": false
    },
    ".claude/agents/claude-plan-review.md": {
      "lastAppliedHash": "cacfdf9dad21c9ef7ebb8c640b54821d67ad2cdeb58f20e5bcc3b17bd5bcc499",
      "lastAppliedFrameworkVersion": "2.73.0",
      "lastAppliedFrameworkCommit": "851d5d35f097f25058adc6a2e54219c69183f05e",
      "lastAppliedSourcePath": ".claude/agents/*.md",
      "customisedLocally": false
    },
    ".claude/agents/claude-spec-review.md": {
      "lastAppliedHash": "7d9d53ba3acc9b0dc89fd760bc77f36d41d55457d12cd9568df05bec08701c15",
      "lastAppliedFrameworkVersion": "2.73.0",
      "lastAppliedFrameworkCommit": "851d5d35f097f25058adc6a2e54219c69183f05e",
      "lastAppliedSourcePath": ".claude/agents/*.md",
      "customisedLocally": false
    },
    ".claude/agents/codebase-explainer.md": {
      "lastAppliedHash": "c63ea77db36695387c9e91dc642d4f81a96952bb1496ccbe996f186cf636723a",
      "lastAppliedFrameworkVersion": "2.61.3",
      "lastAppliedFrameworkCommit": "967ed5ea5aa9eb7dc13438822b9e743c9fa480c1",
      "lastAppliedSourcePath": ".claude/agents/*.md",
      "customisedLocally": false
    },
    ".claude/agents/context-pack-loader.md": {
      "lastAppliedHash": "c8c76316b3afe3dc3e65b02c27776ebbaadc275fe95910245b4e7a1eab21311a",
      "lastAppliedFrameworkVersion": "2.73.0",
      "lastAppliedFrameworkCommit": "851d5d35f097f25058adc6a2e54219c69183f05e",
      "lastAppliedSourcePath": ".claude/agents/*.md",
      "customisedLocally": false
    },
    ".claude/agents/cross-repo-scout.md": {
      "lastAppliedHash": "6b27d39d5399b16e3af61e611dee329a4492f585150707354ada0ae6b6bcf7b9",
      "lastAppliedFrameworkVersion": "2.73.0",
      "lastAppliedFrameworkCommit": "851d5d35f097f25058adc6a2e54219c69183f05e",
      "lastAppliedSourcePath": ".claude/agents/*.md",
      "customisedLocally": false
    },
    ".claude/agents/dual-reviewer.md": {
      "lastAppliedHash": "ce89648c6d0387e35d61330af3e8c8b9ee7e4f73fc93b976b4d2128ce410b374",
      "lastAppliedFrameworkVersion": "2.73.0",
      "lastAppliedFrameworkCommit": "851d5d35f097f25058adc6a2e54219c69183f05e",
      "lastAppliedSourcePath": ".claude/agents/*.md",
      "customisedLocally": false
    },
    ".claude/agents/experiment-runner.md": {
      "lastAppliedHash": "4d321bb17fcc120d12a8d2a9a044ba0b26a903a217cade1c62b809f2c8acd31b",
      "lastAppliedFrameworkVersion": "2.61.3",
      "lastAppliedFrameworkCommit": "967ed5ea5aa9eb7dc13438822b9e743c9fa480c1",
      "lastAppliedSourcePath": ".claude/agents/*.md",
      "customisedLocally": false
    },
    ".claude/agents/feature-coordinator.md": {
      "lastAppliedHash": "f5a5f0ba3a4bcb3b05578082374f510bc739a8ff046e142da7b9a77265eb585c",
      "lastAppliedFrameworkVersion": "2.73.0",
      "lastAppliedFrameworkCommit": "851d5d35f097f25058adc6a2e54219c69183f05e",
      "lastAppliedSourcePath": ".claude/agents/*.md",
      "customisedLocally": false
    },
    ".claude/agents/finalisation-coordinator.md": {
      "lastAppliedHash": "8a558f893374d5308ca95dec25b3af21be8f03d7edcad9377bab15f09e6e4fc9",
      "lastAppliedFrameworkVersion": "2.73.0",
      "lastAppliedFrameworkCommit": "851d5d35f097f25058adc6a2e54219c69183f05e",
      "lastAppliedSourcePath": ".claude/agents/*.md",
      "customisedLocally": false
    },
    ".claude/agents/hotfix.md": {
      "lastAppliedHash": "875c54623bb542cc409937603886306b39901568d2bf59a19cee87d443daddaa",
      "lastAppliedFrameworkVersion": "2.73.0",
      "lastAppliedFrameworkCommit": "851d5d35f097f25058adc6a2e54219c69183f05e",
      "lastAppliedSourcePath": ".claude/agents/*.md",
      "customisedLocally": false
    },
    ".claude/agents/incident-commander.md": {
      "lastAppliedHash": "3707f2a1680a194e51b7130f95dec4936fdc8082239ee91969b64d6c3441473c",
      "lastAppliedFrameworkVersion": "2.73.0",
      "lastAppliedFrameworkCommit": "851d5d35f097f25058adc6a2e54219c69183f05e",
      "lastAppliedSourcePath": ".claude/agents/*.md",
      "customisedLocally": false
    },
    ".claude/agents/mockup-coordinator.md": {
      "lastAppliedHash": "efb439e54aedb9b96d82c4f7101e1b263cd53affcf0d2d889f234a5a805aeb0b",
      "lastAppliedFrameworkVersion": "2.73.0",
      "lastAppliedFrameworkCommit": "851d5d35f097f25058adc6a2e54219c69183f05e",
      "lastAppliedSourcePath": ".claude/agents/*.md",
      "customisedLocally": false
    },
    ".claude/agents/mockup-designer.md": {
      "lastAppliedHash": "4923594a9e2ab9060b7f43fa5aed39d0f4a467874aee856bdb4223526baa9762",
      "lastAppliedFrameworkVersion": "2.73.0",
      "lastAppliedFrameworkCommit": "851d5d35f097f25058adc6a2e54219c69183f05e",
      "lastAppliedSourcePath": ".claude/agents/*.md",
      "customisedLocally": false
    },
    ".claude/agents/mockup-reviewer.md": {
      "lastAppliedHash": "69f021ea4f173dbea621cfd1d129df075780378926aeffd1f6414c0b6d428e1d",
      "lastAppliedFrameworkVersion": "2.73.0",
      "lastAppliedFrameworkCommit": "851d5d35f097f25058adc6a2e54219c69183f05e",
      "lastAppliedSourcePath": ".claude/agents/*.md",
      "customisedLocally": false
    },
    ".claude/agents/pr-reviewer.md": {
      "lastAppliedHash": "195a87d358f782cfa3a8d9076c4cf091bc3d321b04c125d7ead315788d019515",
      "lastAppliedFrameworkVersion": "2.73.0",
      "lastAppliedFrameworkCommit": "851d5d35f097f25058adc6a2e54219c69183f05e",
      "lastAppliedSourcePath": ".claude/agents/*.md",
      "customisedLocally": false
    },
    ".claude/agents/reality-checker.md": {
      "lastAppliedHash": "242b1ad5365d6b214f7878089b366159959a9992ca46334ad3ed24073450e4f0",
      "lastAppliedFrameworkVersion": "2.19.0",
      "lastAppliedFrameworkCommit": "ed577bd758372fc2c1e3871717a0f1f672032a8d",
      "lastAppliedSourcePath": ".claude/agents/*.md",
      "customisedLocally": false
    },
    ".claude/agents/spec-conformance.md": {
      "lastAppliedHash": "6aa16a1dd7c7ee459640730e5838eb2bf63934552695fae71370f08a91512d2a",
      "lastAppliedFrameworkVersion": "2.73.0",
      "lastAppliedFrameworkCommit": "851d5d35f097f25058adc6a2e54219c69183f05e",
      "lastAppliedSourcePath": ".claude/agents/*.md",
      "customisedLocally": false
    },
    ".claude/agents/spec-coordinator.md": {
      "lastAppliedHash": "817291b9d3d920d9bce33d0010bfa2c75ff5610e5515df9119d52d0efd8d87f4",
      "lastAppliedFrameworkVersion": "2.73.0",
      "lastAppliedFrameworkCommit": "851d5d35f097f25058adc6a2e54219c69183f05e",
      "lastAppliedSourcePath": ".claude/agents/*.md",
      "customisedLocally": false